,col
185,"NO SOVIET WHEAT BONUS TALK PLANNED FOR MEETING U . S . Agriculture Secretary Richard Lyng does not intend to discuss a wheat export enhancement initiative to the Soviet Union at a cabinet - level Economic Policy Council meeting set for tomorrow , an aide to Lyng said . "" He ( Lyng ) does not intend to bring it up ,"" the aide said , adding that the subsidy offer remains "" dormant ."" Lyng plans to spend "" about five minutes "" reviewing the status of farm legislation on Capitol Hill before the Economic Policy Council , which is responsible for guiding the administration ' s economic policy , the aide said . The USDA secretary met this morning with members of the House Foreign Affairs Committee , but the handful of lawmakers present did not ask whether the administration intended to offer Moscow a wheat export bonus , the aide said ."
186,EC REJECTS ALL FREE MARKET WHEAT EXPORT OFFERS AT WEEKLY TENDER - TRADERS EC REJECTS ALL FREE MARKET WHEAT EXPORT OFFERS AT WEEKLY TENDER - TRADERS
187,"EC AWARDS 123 , 000 TONNES BARLEY EXPORT LICENCES AT 138 . 75 ECUS PER TONNE - TRADERS EC AWARDS 123 , 000 TONNES BARLEY EXPORT LICENCES AT 138 . 75 ECUS PER TONNE - TRADERS"
188,"FRENCH CEREAL EXPORTS THROUGH ROUEN FALL French cereal exports through the port of Rouen fell 6 . 4 pct to 725 , 023 tonnes during the period February 1 to 25 , from 774 , 704 for the period February 1 to 26 last year , trade sources said . Main destinations were Saudi Arabia with 158 , 109 tonnes of barley , the Soviet Union 147 , 214 of wheat , Italy 104 , 704 of wheat , Spain 91 , 381 of wheat and maize , China 52 , 500 of wheat and Algeria 41 , 000 of wheat . Between February 26 and today , five ships have loaded 137 , 000 tonnes of cereals , the sources added . The 137 , 000 tonnes comprised 59 , 500 tonnes of wheat for China , 53 , 000 of wheat for the Soviet Union and 24 , 500 of wheat for Algeria . By this Friday , sources estimated a further 233 , 600 tonnes of cereals will have been loaded , comprising 47 , 000 tonnes of barley , 78 , 600 of wheat and 25 , 000 of rapeseed for the Soviet Union , 30 , 000 of wheat for Sri Lanka , 28 , 000 of wheat for China and 25 , 000 of wheat for Poland ."
189,"EC AWARDS EXPORT LICENCES FOR 25 , 000 TONNES MAIZE - PARIS TRADE . EC AWARDS EXPORT LICENCES FOR 25 , 000 TONNES MAIZE - PARIS TRADE ."
190,"EC REJECTS WHEAT EXPORT BIDS , GRANTS BARLEY The European Community ' s cereal management committee rejected all bids to export free market soft wheat at today ' s weekly tender , traders said . The committee awarded 123 , 000 tonnes of free market barley export licences at a maximum export refund of 138 . 75 Ecus per tonne ."
191,"PARIS TRADE DETAILS EC GRAIN TENDER RESULT The EC Commission rejected all bids for free market bread - making and feed wheat and all bids for the special West German tender at today ' s weekly EC cereals tender , trade sources said here . It granted export licences for 123 , 000 tonnes of free market barley at a maximum rebate of 138 . 75 Ecus per tonne and 25 , 000 tonnes of maize at a maximum rebate of 133 . 75 Ecus , they said . Licences for 100 , 000 tonnes of the barley were awarded to French trade houses , they added ."
192,"WORLD GRAIN TRADE RECOVERY MAY BE UNDERWAY World grain trade could be turning the corner and heading toward recovery in the 1986 - 87 season , a Cargill , Inc . analyst said . Writing in the March issue of the Cargill Bulletin , David Rogers of Cargill ' s Commodity Marketing Division cited a gradual rise in world wheat trade in recent months , with a slow rise in wheat prices after recent historic lows . He said the wheat trade , because wheat can be produced in many nations , is a good barometer of world grain trade and could lead to more activity in other grain markets . Rogers said that with world grain prices at their lowest level in over a quarter of a century in real terms , demand has begun to rise while producing nations are re - examining their expensive price - support policies and reducing planted acres ."
193,"TRADERS DETAIL IRISH INTERVENTION BARLEY TENDER The European Commission authorised the export of 33 , 500 tonnes of Irish intervention barley at today ' s tender for non - European Community destinations at 53 . 10 Ecus per tonne , grain traders said ."
194,"EC OPENS SPECIAL REBATE FOR MAIZE - PARIS TRADE The EC Commission decided to open a special daily export rebate today for maize exports to Morocco , Israel , Canary Islands and zone 5c ( Sub - Saharan Africa ), trade sources said here . The rebate was set at 153 European currency units per tonne for March and 133 for April through July ."
195,"THAI RICE EXPORTS RISE IN WEEK ENDED FEBRUARY 24 Thailand exported 84 , 960 tonnes of rice in the week ended February 24 , up from 80 , 498 the previous week , the Commerce Ministry said . It said government and private exporters shipped 27 , 510 and 57 , 450 tonnes respectively . Private exporters concluded advance weekly sales for 79 , 448 tonnes against 79 , 014 the previous week . Thailand exported 689 , 038 tonnes of rice between the beginning of January and February 24 , up from 556 , 874 tonnes during the same period last year . It has commitments to export another 658 , 999 tonnes this year ."
196,"INDONESIAN AGRICULTURE GROWTH EXPECTED TO SLOW Indonesia "" s agriculture sector will grow by just 1 . 0 pct in calendar 1987 , against an estimated 2 . 4 pct in 1986 as the production of some commodities stagnates or declines , the U . S . Embassy said in a report . Production of Indonesia "" s staple food , rice , is forecast to fall to around 26 . 3 mln tonnes from an embassy estimate of 26 . 58 mln tonnes in 1986 , according to the annual report on Indonesia "" s agricultural performance . The government officially estimates 1986 rice production at 26 . 7 mln tonnes , with a forecast 27 . 3 mln tonnes output in 1987 . The report says wheat imports are likely to fall to 1 . 5 mln tonnes in calendar 1987 from 1 . 69 mln tonnes in 1986 because of a drawdown on stocks . "" Growth prospects for agriculture in 1987 do not look promising as rice production is forecast to decline and the production of sugarcane , rubber and copra show little or no gain ,"" the report says . "" The modest overall increase which is expected will be due to significant gains in production of corn soybeans , palm oil and palm kernels ."" Constraints to significant overall increases in agricultural output include a shortage of disease resistant seeds , limited fertile land , insect pests and a reluctance by farmers to shift from rice production to other crops , the report underlines . The fall in rice production is caused by an outbreak of pests known as "" wereng "" or brown plant hoppers in 1986 which largely offset gains in yields . The outbreak has forced the government to ban the use of 57 insecticides on rice because it was believed the wereng are now resistant to these varieties , and to use lower - yielding , more resistant rice types . The government is depending on increased production of export commodities such as coffee , tea , rubber , plywood and palm oil to offset revenue losses brought on by falling crude oil prices . Palm oil production is expected to increase by over 7 . 0 pct in 1987 to 1 . 45 mln tonnes from 1 . 35 mln , with exports rising to an estimated 720 , 000 tonnes from 695 , 000 tonnes in 1986 , the report says . But while production of soybeans in 1987 / 88 ( Oct - Sept ) will rise to 1 . 075 mln tonnes from 980 , 000 in 1986 / 87 , imports will also rise to supply a new soybean crushing plant . The report says that imports of wheat , soybeans , soybean meal and cotton are not likely to decline as a result of last September "" s 31 pct devaluation of the rupiah because of a rise in domestic demand . The report said that Indonesia "" s overall economic performance in calendar 1986 was about zero or even a slight negative growth rate , the lowest rate of growth since the mid - 1960s . It compares with 1 . 9 pct growth in 1985 and 6 . 7 pct in 1984 . The dramatic fall in oil prices last year was responsible for the slump ."
197,"HOUSE 0 / 92 FARM PROPOSAL SEEN SPARKING DEBATE A House Agriculture Committee meeting later today to draft a disaster aid bill is expected to spark a debate between lawmakers who want to expand the 0 / 92 , or "" de - coupling ,"" provision to cover feedgrains , and those who oppose 0 / 92 or want it severely limited , Congressional sources said . The disaster aid bill as it now stands calls for a one - year 0 / 92 pilot program for 1987 crop wheat and the 1988 winter wheat crop . The bill would allow farmers to forego planting and still receive 92 pct of deficiency payments . The administration has strongly urged that the bill be expanded to feedgrains and to more than one year . It is difficult to tell in what form the 0 / 92 provision will emerge from the committee , the sources said . Proponents of an expansion of 0 / 92 maintain there are large estimated cost savings of such a bill -- ranging from estimates by the administration of 200 to 500 mln dlrs . Opposition to a reopening of the 1985 farm bill at this time is the major reason cited by those against an expansion of the bill , committee staffers said . The 0 / 92 plan is scheduled to be discussed at 1530 EST . A conflicting floor vote delayed the start of the meeting , and staffers said it may have to be delayed even until next week . Such a delay would not bode well for proponents of an expanded 0 / 92 program , since spring planting in many areas of the country will be underway in the next few weeks and signup for the 1987 wheat and feedgrains program ends March 30 . Farmers are now making their planting decisions , so something has to be done quickly if a 0 / 92 program is to be implemented , an Agriculture Department source said . An expansion of 0 / 92 to feedgrains was opposed in last week ' s subcommittee hearing on the bill , with subcommittee chairman Dan Glickman , D - Kan ., saying that more study of the consequences of decoupling on feedgrains plantings was necessary . Major commodity groups , including the National Corn Growers , the American Farm Bureau and the National Cattlemen ' s Association , have voiced strong opposition to 0 / 92 . But proponents of an expanded 0 / 92 argue that the bill currently is not equitable for all grains producers , so it should be extended to other crops . There will be difficulty in limiting 0 / 92 to wheat , said Gene Moos , aide to house majority leader Tom Foley , D - Wash . Projected cost savings , in the current atmosphere of try to decrease farm expenditures , would also be hard to ignore in the debate to expand the 0 / 92 application , Moos said . Rep . Charles Stenholm , D - Tex ., may be planning to introduce a bill to restrict 0 / 92 to only 1987 crop wheat , with the argument that now is not the time to vote in favor of any major changes in the farm bill . "" Stenholm ' s bill is not a rejection of 0 / 92 , only of the timing ,"" a congressional staff member said . Rep . Arland Stangeland ( R - Minn .) is reported to have an amendment to expand the 0 / 92 provision to 1987 and 1988 feedgrains ."
198,"CHINA ADDS , CANCELS WHEAT COMMITMENTS - USDA China has added 90 , 000 tonnes of U . S . wheat to its purchases for delivery in the 1987 / 88 season and cancelled 30 , 000 tonnes of wheat purchases for delivery in the 1986 / 87 season , the U . S . Agriculture Department said . According to the department ' s Export Sales Report covering transactions in the week ended February 26 , China has outstanding wheat commitments for the 1986 / 87 season of 30 , 000 tonnes and 420 , 000 tonnes for delivery in the 1987 / 88 season . The wheat season begins June 1 . China has total corn commitments for 1986 / 87 of 1 , 011 , 200 tonnes and soybeans commitments of 157 , 500 tonnes . The season for corn and soybeans began September 1 ."
199,"CHINESE WHEAT CROP THREATENED BY PESTS , DISEASE China ' s wheat crop this year is seriously threatened by plant pests and diseases , the New China News Agency said . More than 5 mln hectares of wheat - producing land in North China could be affected because relatively warm and dry weather had allowed bacteria and insect eggs to survive the winter , the agency added . China "" s Ministry of Agriculture , Animal Husbandry and Fisheries has called for measures including the timely supply of pesticides to farmers to combat the threat , it said ."
200,"HOUSE 0 / 92 FARM PLAN MARKUP DELAYED TILL TUESDAY A House Agriculture Committee meeting to draft a disaster aid bill containing a controversial 0 / 92 provision has been postponed until next Tuesday , committee staff members announced . The bill contains a provision implementing a 0 / 92 acreage reduction plan for 1986 wheat and 1987 winter wheat , thereby making payments available to farmers who were not able to plant last year ' s winter wheat crop because of flooding . Controversy exists over whether the 0 / 92 provisions of the bill should be expanded , cut back or left as is ."
201,"BRAZIL SUSPENDS IMPORT OF 500 , 000 TONNES MAIZE Brazil has suspended the importation of 500 , 000 tonnes of maize ordered last year because of the excellent domestic maize harvest expected this year , Agriculture Minister Iris Resende said . The Agriculture Ministry expects a record maize crop of 27 . 7 mln tonnes , a 36 pct increase on last year ' s crop of 20 . 3 mln tonnes . Brazil ' s total grain crop is expected to be 65 . 3 mln tonnes . "" This is a record in the history of Brazilian agriculture ,"" a ministry spokesman said . Resende announced suspension of the maize imports at a news conference in Brasilia yesterday . The ministry spokesman said he had no other details on the maize transaction ."
202,"USDA COMMENTS ON EXPORT SALES Corn sales gained 2 , 494 , 900 tonnes in the week ended February 26 , the highest weekly total since August 1984 and two and three - quarter times the prior week ' s level , the U . S . Agriculture Department said . In comments on its Export Sales Report , the department said sales of 1 . 0 mln tonnes to the USSR -- previously reported under the daily reporting system -- were the first sales for delivery to the USSR under the fourth year of the U . S .- USSR Grains Supply Agreement , which began October 1 . Japan added 689 , 700 tonnes to previous purchases and sales to unknown destinations rose by 429 , 800 tonnes . Wheat sales of 362 , 400 tonnes for the current season and 151 , 000 for the 1987 / 88 season were down by more than half from the previous week ' s combined sales , it said . Egypt , Japan and Iraq were the major wheat buyers for delivery in the current year , while sales to China decreased by 30 , 000 tonnes for the current season , but increased by 90 , 000 tonnes for the 1987 / 88 season , which begins June 1 . Net sales of soybeans totalling 274 , 200 tonnes equaled the preceding week , but were nearly a third below the four week average . Major increases were for Belgium , South Korea , Mexico and Italy , it said . Soybean cake and meal sales of 103 , 700 tonnes were 2 - 3 / 4 times the previous week ' s marketing year low , but six pct less than the four week average . Major increases for West Germany , Belgium , Spain , Italy and Australia were partially offset by declines to unknown destinations . Soybean oil sales of 5 , 400 tonnes were the result of increases for Venezuela and reductions of 500 tonnes for unknown destinations . Combined sales activity in cotton of 75 , 200 running bales -- 44 , 700 bales for the current year and 30 , 500 bales for the 1987 / 88 bales -- were 56 pct below the prior week ' s good showing , the department said . Major purchasers for the current season were South Korea , Japan , Taiwan and Thailand , while South Korea and Indonesia were the major buyers for the 1987 / 88 season , which begins August 1 ."
203,"HOUSE 0 / 92 PLAN SEEN SCALED - BACK TO 1987 WHEAT Key members of the House Agriculture committee have agreed to scale - back the 0 / 92 provision of a pending disaster aid bill to cover only 1987 crop wheat , but a broader 0 / 92 proposal is likely to be resurrected later , Congressional sources said . The sources said key lawmakers including Reps . Glenn English ( D - Okla .), and Dan Glickman ( D - Kan .) agreed to support an amendment to be offered next week by Rep . Charles Stenholm ( D - Tex .) which would limit 0 / 92 only to producers of 1987 crop winter and spring wheat . This would scale - back the 0 / 92 provision to the original proposal by English allowing a pilot 0 / 92 program for 1987 wheat only . That provision was later broadened by the subcommittee to include 1988 crop winter wheat . Under 0 / 92 , a farmer can forego planting a crop but still collect 92 pct of deficiency payments . Earlier today , the House Agriculture committee postponed until next Tuesday a meeting to consider the disaster aid bill and 0 / 92 . The agreement to limit 0 / 92 to a wheat pilot program follows vocal criticism of the proposal by some influential farm groups who are concerned about the major impact of 0 / 92 , and by members of Congress wary of reopening the farm bill . Congressional sources said there has not been enough time to study the implications of a broad 0 / 92 . "" The timing ( of the proposal ) is off ,"" said one aide to a House Agriculture committee member . However , several Congressional sources said they expect a broader 0 / 92 provision to emerge again when the House Agriculture committee is faced next month with the need to make spending cuts in the agriculture budget for fiscal 1988 as part of an overall deficit reduction package . Gene Moos , aide to House Majority leader Tom Foley ( D - Wash .), predicted agriculture ' s share of budget cuts may exceed one billion dlrs . A broader 0 / 92 might be resurrected later because both the Congressional Budget Office and the Reagan administration estimate it would result in significant budget savings . A U . S . Agriculture Department official said 0 / 92 for all 1987 crops would save 300 to 400 mln dlrs and more than 1 . 5 billion dlrs over five years . Another factor which could affect the 0 / 92 debate is the approach of planting season , Congressional sources said . Some officials said it already is late for implementation of a 0 / 92 in 1987 because farm program signup ends March 31 for wheat and feedgrains . If Congress approved 0 / 92 later in the year sign - up either would have to be extended or reopened , sources said ."
204,"U . S . SENATE GROUP URGES SUBSIDIES FOR USSR A majority of the Senate Agriculture Committee urged President Reagan to reverse his opposition to export subsidies to the Soviet Union as a way to get its negotiators to purchase some 500 mln dlrs in American wheat . The group , led by committee chairman Patrick Leahy , a Vermont Democrat , urged Reagan to step up negotiations with the Soviet Union by providing export subsidies to help U . S . farmers ."
205,"CANADA - EGYPT WHEAT NEGOTIATIONS TO CONTINUE Canadian and Egyptian wheat negotiators failed to conclude an agreement on Canadian wheat exports to Egypt during talks last week , but the Canadian team will return to Cairo for further negotiations , Canadian embassy officials said . An embassy official declined to identify which issues remained to be resolved and when the talks would resume . In a five - year protocol signed in 1985 , Cairo agreed to purchase 500 , 000 tonnes of Canadian wheat a year ."
206,"ARGENTINA - BRAZIL TRADE JUMPED 90 PCT IN 1986 Trade between Argentina and Brazil jumped 90 pct in 1986 versus 1985 , Foreign Minister Dante Caputo said . Speaking to reporters , Caputo said the near doubling in trade showed the "" tangible and immediate results "" of a wide - ranging economic integration accord signed by the presidents of both countries last July . He said trade last year totalled 1 . 3 billion dlrs versus 700 mln dlrs in 1985 . The accord provided for capital goods trade between the two countries to rise to 2 . 0 billion dlrs over four years . Argentine wheat exports to Brazil will increase from 1 , 375 , 000 tonnes in 1987 to 2 . 0 mln tonnes in 1991 , the accord said ."
207,"INDONESIAN WHEAT IMPORTS EXPECTED TO FALL IN 1987 Indonesia ' s wheat imports are expected to fall to 1 . 5 mln tonnes in calendar 1987 from 1 . 69 mln in 1986 , the U . S . Embassy ' s annual agriculture report said . It said the drop was expected , because there will be a drawdown on stocks built up near the end of 1986 . It said wheat stocks at the end of 1986 were 390 , 000 tonnes , up from 223 , 000 at end - 1985 . It forecast end - 1987 stocks at around 290 , 000 tonnes . The main suppliers in 1986 were Australia ( 44 pct ), the U . S . ( 29 pct ), Canada ( 12 pct ), Argentina ( 8 pct ) and Saudi Arabia ( 5 pct )."
208,"CANADA RULES U . S . CORN INJURING CANADIAN FARMERS , UPHOLDS DUTY CANADA RULES U . S . CORN INJURING CANADIAN FARMERS , UPHOLDS DUTY"
209,"CANADA RULES U . S . CORN INJURING CANADIAN FARMERS , UPHOLDS DUTY CANADA RULES U . S . CORN INJURING CANADIAN FARMERS , UPHOLDS DUTY"
210,CANADA UPHOLDS COUNTERVAIL DUTY ON U . S . CORN The Canadian Import Tribunal ruled today subsidized U . S . corn imports were injurious to Canadian growers and upheld a countervailing duty of 84 . 9 U . S . cts a bushel set earlier this year . The ruling is the result of trade action launched in 1985 by the Ontario Corn Producers Association that contended U . S . subsidies were driving American corn prices below Canadian production costs . A spokesman for the Department of Revenue said a study of the level of the duty will be undertaken in the next six months to determine if it should be adjusted .
211,"LYNG DISAPPOINTED BY CANADA CORN INJURY DECISION U . S . Agriculture Secretary Richard Lyng said he is "" very disappointed "" by a Canadian government finding that U . S . corn has injured Ontario Corn growers . "" This action is not helpful in the context of the ongoing U . S .- Canada free trade talks or in the new round of multilateral trade negotiations ,"" Lyng said in a statement . The Canadian government today said Ottawa would continue to apply a duty of 84 . 9 cents per bushel on U . S . corn imports . Lyng said the U . S . made a case that U . S . corn imports are not the cause of any problem of Canadian corn producers , adding that U . S . corn exports to Canada are declining . "" Apparently they ( Canada ) have ignored the fact that Canadian corn and other coarse grain production is rising faster than consumption ,"" Lyng said ."
212,"U . S . WHEAT GROWERS WANT EEP TO SOVIET UNION The U . S . National Association of Wheat Growers ( NAWG ) urged the Reagan administration offer the Soviet Union wheat under the export enhancement program ( eep ). In a letter to Agriculture Secretary Richard Lyng , NAWG stated its "" strong support "" for an eep offer to Moscow . "" We believe that a solid case continues to exist for Soviet EEP eligibility , and the recently announced and reported Soviet purchases of U . S . corn indicate a Soviet willingness to purchase U . S . grain if it is competitively priced ,"" NAWG said . "" Consequently , we believe it is important to renew the U . S . eep offer and do all that is reasonably possible to ensure mutual adherence to the terms of the U . S .- Soviet grain agreement ,"" the letter said ."
213,"USSR WHEAT BONUS OFFER SAID STILL UNDER DEBATE The Reagan administration continues to debate whether to offer subsidized wheat to the Soviet Union , but would need assurances from the Soviets that they would buy the wheat before the subsidy offer would be made , a senior U . S . Agriculture Department official said . "" I think it still is under active debate whether or not it would be advisable "" to make an the export enhancement offer to the Soviets , Thomas Kay , administrator of the department ' s Foreign Agriculture Service , told Reuters . "" We ' d need some assurances from them ( the Soviets ) that they would buy if offered "" the wheat under the subsidy plan , he said . Kay called reports that such an offer was imminent "" premature ."" The Reagan administration ' s cabinet - level Economic Policy Council is set to meet today to discuss , among other matters , agricultural policy but is not expected to address a wheat subsidy offer to the Soviet Union , administration officials said earlier ."
214,"CANADA CORN DECISION UNJUSTIFIED - YEUTTER U . S . trade representative Clayton Yeutter said Canada ' s finding announced today that U . S . corn imports injure Canadian farmers is "" totally unjustified ."" "" U . S . corn exports to Canada are so small that it is inconceivable that they injure Canadian corn farmers by any reasonable measure ,"" Yeutter said in a statement . He said if other countries follow Canada ' s lead it could result in "" a rash of protectionist actions throughout the world ."" French corn growers have recently indicated they will challenge U . S . corn gluten feed shipments to Europe . Yeutter said the U . S . will examine the Canadian decision closely and if the U . S . believes the decision was not based on facts , "" will carefully evaluate appropriate responses ."" Yeutter did not say what steps the U . S . may take in response ."
