,col
374,"USDA NOT PLANNING ANY MAJOR PRICING CHANGES The Agriculture Department is not considering any major changes in its pricing system for posted county prices , an Agriculture Department offical said . "" We do not have current plans to make any major adjustments or changes in our pricing ,"" said Bob Sindt , USDA assistant deputy administrator for commodity operations . U . S . grain traders and merchandisers said earlier this week USDA might act soon to reduce the cash corn price premium at the Gulf versus interior price levels by dropping ASCS posted prices to encourage interior PIK and roll movement . But Sindt denied USDA is planning any such changes . "" If people are suggesting that we are going to make wholesale changes in pricing , we are not considering this ,"" he said . Sindt , however , did not rule out the possiblity of implementing more minor changes in its pricing system . "" We are continually monitoring the whole nationwide structure to maintain its accuracy ,"" he said . "" If we become convinced that we need to make a change , then appropriate adjustments will be made ."" Sindt acknowledged that concern has been voiced that USDA ' s price differentials between the New Orleans Gulf and interior markets are not accurate because of higher than normal barge freight rates . He said commodity operations deputy administrator Ralph Klopfenstein is currently in the midwest on a speaking tour and will meet with ASCS oficials in Kansas City next week . Sindt said a number of issues will be discussed at that meeting , including the current concern over the gulf corn premiums . He defended the USDA differentials , saying that these price margins reflect an average of prices throughout the year and that seasonal factors will normally cause prices to increase or decrease . The USDA official also said that only those counties that use the Gulf to price grain are being currently affected by the high barge freight tariffs and increased gulf prices . When asked if the USDA emergency storage program which allows grain to be stored in barges was taking up barge space and accounting for the higher freight rates , Sindt discounted the idea . He said USDA has grain left in only about 250 barges and that , under provisions of the program , these all have to be emptied by the end of March ."
375,"CONCERN OVER "" EL NINO "" IN PERU - USDA REPORT There are heightened fears that "" El Nino "" may be returning to Peru with an intensity approaching the 1983 disaster , which affected the weather on several continents and caused widespread damage through floods and drought , the U . S . Agriculture Department ' s officer in Lima said in a field report . Continued heavy rains in the northern coastal area , flooding of several major rivers and mud slides have led to increased concern , the report , dated March 17 , said . However , it said official sources still believe that this year ' s El Nino will have only weak to moderate intensity . EL Nino is a phenomenon involving a shift in winds and waters in the pacific . The USDA report said that so far the El Nino now being experienced has not had an overall negative impact on agricultural production . Excessive rains in the Piura Pima cotton area may reduce yields by about 20 pct due to excessive growth too early in the crop cycle . Also insect damage to crops could be more extensive where excessive moisture exists , it said . However , the El Nino has resulted in a much improved supply of irrigation water in the major dams which will improve prospects for many crucial crops such as rice and corn , and slow the decline in sugar production , it said . If El Nino picks up momentum , Peru ' s fishing industry could receive a setback . But trade sources still believe the fish catch for industrial processing will reach 5 . 5 mln tonnes in 1987 , almost 20 pct above last year , the report said . Water temperatures in the northern fishing areas are three to four degrees centigrade above normal but still not high enough to drive the fish to cooler southern waters , it said . It said there is still the outside chance that El Nino will intensify and carry on through late March , April and May causing problems as crops approach harvest . "" There appears to be no way to project the course of El Nino -- only time will tell ,"" the report said ."
376,"ANALYST SAYS USSR WINTER GRAINS HURT BY WEATHER The Soviet Union ' s winter grain crop is likely to have suffered losses due to dry planting conditions last fall and severe cold this winter , an analyst of world weather and crop conditions said . Grain analyst and meteorologist Gail Martell , author of the EF Hutton publication "" Global Crop News ,"" said in her latest report that the Soviets may import more grain , possibly wheat , from the U . S . due to potential crop damage . "" Compared with last year , the outlook ( for the Soviet winter grain crop ) is far more pessimistic ,"" she said . "" But it ' s still too early to talk about disastrous losses . A lot will depend on spring weather , not only for the outcome of the troubled winter grain crop , but also for spring planting ."" Martell said the dry weather conditions last fall probably prevented optimal seed germination for winter grains . Key wheat growing areas of the southern Ukraine and North Caucasus received on 25 - 35 pct of autumn precipitation , she said . The bitter winter cold temperatures -- which broke record lows that had stood for four decades -- also may have taken its toll on Soviet winter crops , she said . However , she noted that most of the southern grain belt had ample snow cover , which should have well - insulated the majority of crop areas from severe frost damage . The USSR has already bought 20 to 21 mln tonnes of grains in the July 1986 / June 1987 marketing year , primarily from Canada , the European Community , Argentina and Australia , Martell said . She cited a number of reasons besides possible crop problems that might point to additional Soviet import demand . Last fall ' s dry weather may limit livestock grazing on moisture - depleted pastures , while the cold winter weather necessitated supplemental feeding to keep livestock healthy . Martell was also skeptical of a Soviet claim for a 1986 grain harvest of 210 mln tonnes , and said the Chernobyl accident may have contaminated more grain than originally thought and have to be made up with imports . However , she said the U . S . remains a supplier of last resort for the Soviet Union , noting that the Soviets have only just recently begun their first U . S . grain purchases of the 1986 / 87 season by buying 2 . 25 mln tonnes of corn . Martell cited USDA statistics showing that since the 1980 grain embargo the U . S . is only a major supplier of grain to the USSR during years of heavy Soviet demand . In 1984 / 85 , the U . S . supplied 41 pct of record Soviet grain imports of 55 . 5 mln tonnes . But in 1985 / 86 , the Soviet Union bought 29 . 9 mln tonnes of grain and turned to the U . S . for only 24 pct of that total . While the USDA Soviet import target for grain for 1986 / 87 was 22 mln tonnes , many U . S . grain analysts have revised their estimates of Soviet imports up to 25 - 28 mln tonnes , she said ."
377,"U . S . EXPORTERS REPORT 150 , 000 TONNES CORN CORN SWITCHED FROM UNKNOWN TO USSR FOR 1986 / 87 U . S . EXPORTERS REPORT 150 , 000 TONNES CORN CORN SWITCHED FROM UNKNOWN TO USSR FOR 1986 / 87"
378,"CCC ACCEPTS EXPORT BONUS ON SEMOLINA TO EGYPT The Commodity Credit Corporation , CCC , has accepted a bid for an export bonus to cover a sale of 6 , 000 tonnes of semolina to Egypt , the U . S . Agriculture Department said . The department said the semolina is for shipment April - October , 1987 , and the bonus awarded was 224 . 87 dlrs per tonne . The bonus was made to International Multifoods Corp and will paid to the exporter in the form of commodities from CCC stocks , the department said . An additional 7 , 000 tonnes of semolina are still available to Egypt under the Export Enhancement Program initiative announced August 1 , 1986 , it said ."
379,"LDC FOOD AID NEEDS DECLINE IN 1986 / 87 - USDA Total food aid needs in 69 of the least developed countries declined in 1986 / 87 , as requirments fell in many countries in Africa , the Middle East and Asia , the U . S . Agriculture Department said . In a summary of its World Agriculture Report , the department said grain production in sub - Saharan Africa was a record high in 1986 , with gains in almost every country . However , food needs in Central America rose , worsened by drought - reduced crops and civil strife . Record wheat production in 1986 / 87 is pushing global wheat consumption for food to a new high , and higher yielding varieties have been particularly effective where spring wheat is a common crop , it said . However , may developing countries in tropical climates , such as Sub - Saharan Africa , Southeast Asia , and Central America , are not well adapted for wheat production , and improved varieties are not the answer to rising food needs , the department said . World per capita consumption of vegetable oil will rise in 1986 / 87 for the third straight year . Soybean oil constitutes almost 30 pct of vegetable oil consumption , while palm oil is the most traded , the department said ."
380,"U . S . SUGAR PROGRAM CUT SENT TO CONGRESS BY USDA The U . S . Agriculture Department formally transmitted to Congress a long - awaited proposal to drastically slash the sugar loan rate and compensate growers for the cut with targeted income payments . In a letter to the Congressional leadership accompanying the "" Sugar Program Improvements Act of 1987 "", Peter Myers , Deputy Agriculture Secretary , said the Reagan administration wants the sugar loan rate cut to 12 cents per pound beginning with the 1987 crop , down from 18 cts now . Sugarcane and beet growers would be compensated by the government for the price support cut with targeted income payments over the four years 1988 to 1991 . The payments would cost an estimated 1 . 1 billion dlrs , Myers said . The administration sugar proposal is expected to be introduced in the House of Representatives next week by Rep . John Porter , R - Ill . Congressional sources said the program cut is so drastic it is unlikely to be adopted in either the House or Senate because politically - influential sugar and corn growers and high fructose corn syrup producers will strongly resist . The direct payment plan outlined by the administration targets subsidies to small cane and beet growers and gradually lowers payments over four years . It also excludes from payment any output exceeding 20 , 000 short tons raw sugar per grower . For example , on the first 350 tons of production , a grower would receive 6 cts per lb in fiscal 1988 , 4 . 5 cts in 1989 , 3 cts in 1990 and 1 . 5 cts in 1991 . The income payments would be based on the amount of commercially recoverable sugar produced by a farmer in the 1985 or 1986 crop years , whichever is less , USDA said . Myers said the administration is proposing drastic changes in the sugar program because the current high price support is causing adverse trends in the sugar industry . He said the current program has artificially stimulated domestic sugar and corn sweetener production which has allowed corn sweeteners to make market inroads . U . S . sugar consumption has declined which has resulted in a "" progressive contraction "" of the sugar import quota to only one mln short tons this year , he said . This has hurt cane sugar refiners who rely on imported sugar processing . Furthermore , USDA said the current sugar program gives overseas manufacturers of sugar - containing products a competitive advantage . The result has been higher imports of sugar - containing products and a flight of U . S . processing facilities overseas to take advantage of cheaper sugar . USDA also said the current program imposes a heavy cost on U . S . consumers and industrial users . In fiscal 1987 , USDA said consumers are paying nearly two billion dlrs more than necessary for sugar . "" Enactment of this bill will reduce the price gap between sweeteners and help to correct or stabilize the many adverse impacts and trends which the sugar industry is currently facing ,"" Myers said . The following table lists the rate of payments , in cts per lb , to growers and the quantity covered , in short tons recoverable raw sugar , under the administration ' s proposal to compensate sugar growers with targeted payments . QUANTITY 1988 1989 1990 1991 First 350 tons 6 . 000 4 . 500 3 . 000 1 . 500 Over 350 to 700 5 . 750 4 . 313 2 . 875 1 . 438 Over 700 to 1 , 000 5 . 500 4 . 125 2 . 750 1 . 375 Over 1 , 000 to 1 , 500 5 . 000 3 . 750 2 . 500 1 . 250 Over 1 , 500 to 3 , 000 4 . 500 3 . 375 2 . 250 1 . 125 Over 3 , 000 to 6 , 000 3 . 500 2 . 625 1 . 750 0 . 875 Over 6 , 000 to 10 , 000 2 . 250 1 . 688 1 . 125 0 . 563 Over 10 , 000 to 20 , 000 0 . 500 0 . 375 0 . 250 0 . 125 Over 20 , 000 tons nil nil nil nil"
381,"STRIKE THREAT , LOWER TRAFFIC MAR SEAWAY OPENING The St . Lawrence Seaway , set to reopen March 31 after the winter , faces another tough year because of depressed traffic levels and the possibility of the first strike in 20 years on the Great Lakes , seaway officials said . Depressed grain exports , rising costs , and competing modes of transportation are all expected to result in only a marginal increase over last year ' s traffic levels -- and revenues -- on the 2 , 300 mile waterway , officials said . In 1986 , a season that ran from April 3 to December 27 , the seaway moved 37 . 6 mln metric tons of freight between Montreal and Lake Ontario and 41 . 6 mln tons on the Welland Canal , linking Lake Erie and Lake Ontario . By comparison , in 1985 about 37 mln tons of cargo traveled through the Montreal - Lake Ontario section and 42 mln through the eight - lock canal . The waterway is expected to lose 9 - 10 mln Canadian dlrs this year , about the same as the estimated deficit for fiscal 1986 - 87 ending March 31 , said William Blair , an executive member of Canada ' s St Lawrence Seaway Authority . The seaway moves about one - half of Canada ' s exported grain . Those exports of the single most important commodity carried on the waterway have been depressed by world surpluses . The Seafarers ' International Union , which represents about 2 , 300 workers on the Great Lakes and the ocean coasts , has said it will likely go on strike this spring to protest employers ' demands for wage rollbacks and other concessions . "" It ' s 99 . 9 pct ( certain )-- I guarantee you a strike ,"" Roman Gralewicz , head of the Seafarers ' Canadian branch , has said . The Canadian government has called in a labor conciliator to try to hammer out a contract agreement between the two sides . The seaway authority said a walkout tying up ships on the Great Lakes would badly hurt traffic . "" We haven ' t had a strike on the seaway for years ... a prolonged strike would have a disasterous effect ,"" Seaway Authority spokeswoman Gay Hemsley said . "" These are the heaviest contract talks in the history of the St Lawrence Seaway ,"" George Miller , vice - president of the Canadian Lake Carriers Association , an association of major Canadian shipping companies , said recently . The workers ' current contract expires May 31 . The association said it is asking for a five per cent cut in wages for the next three years , reduced crew levels and the power to restructure crew dispatching . The association said its members recorded about a 6 mln dlrs ( U . S .) loss in each of 1985 and 1986 due to lower traffic and freight rates and increasing competition . The seaway said 1985 was its worst year in two decades . Hemsley said the seaway authority plans to raise tolls on the Welland Canal by eight pct this year , compared to last year ' s 15 pct rise , while maintaining a freeze on tolls throughout the rest of the waterway . Canada is responsible for 13 of the seaway ' s 15 locks and about 85 pct of its revenues and maintenance costs . "" We may see and hope for a steady upward climb ... but we won ' t see a major increase for a number of years ,"" Hemsley said . A Canada - U . S . delegation to promote the seaway to shippers in Western Europe should result in some increased traffic this season but the full benefits won ' t be felt for several years , Blair said ."
382,"TAIWAN TO BOOST FARM IMPORTS FROM U . S ., EUROPE Taiwan is expected to boost agricultural imports from the U . S . And Europe in calendar 1987 to help balance trade , the Council of Agriculture said . A council official , who declined to be named , told Reuters the imports , which will include about seven mln tonnes of oilseeds , grains and dairy products , would be worth some four billion U . S . Dlrs against 3 . 72 billion in 1986 and 3 . 38 billion in 1985 . Taiwan ' s surplus with the U . S . Rose to 13 . 6 billion dlrs last year from 10 . 2 billion in 1985 , government figures show . Government figures also show Taiwan ' s surplus with Europe rose to 1 . 53 billion dlrs last year from 543 mln in 1985 . Taiwan ' s imports of U . S . Farm produce last year amounted to 1 . 41 billion dlrs against 1 . 52 billion in 1985 . Imports from Europe rose to 182 mln U . S . Dlrs from 148 mln , the official said . He attributed the decline in the value of U . S . Imports to falling agricultural products prices last year ."
383,"JAPANESE COMPOUND FEED OUTPUT FALLS IN JANUARY Japanese compound feed output fell to 2 . 06 mln tonnes in January from 2 . 57 mln in December , against 2 . 04 mln a year earlier , Agriculture Ministry statistics show . January sales totalled 2 . 07 mln tonnes against 2 . 59 mln in December and 2 . 04 mln a year earlier , while end - month stocks were 233 , 003 tonnes against 230 , 764 and 241 , 567 . Base mixes for the January compound feed output included corn , sorghum and soybean meal . Corn use totalled 993 , 156 tonnes , against 1 . 20 mln in December and 896 , 718 a year earlier , and its compounding ratio was 48 . 1 pct against 46 . 6 pct and 43 . 1 pct . Sorghum use totalled 339 , 013 tonnes in January against 459 , 067 in December and 412 , 743 a year earlier , and its compounding ratio was 16 . 4 pct against 17 . 8 pct and 19 . 8 pct , the ministry ' s figures shows . Soybean meal use amounted to 202 , 546 tonnes against 253 , 498 and 213 , 287 and its compounding ratio was 9 . 8 pct against 9 . 8 pct and 10 . 2 pct ."
384,"DENG SETS LIMIT TO CHINA GRAIN IMPORTS , PAPER SAYS China ' s top leader Deng Xiaoping said China must not import more than 10 mln tonnes of grain , Ming Pao newspaper of Hong Kong said . Customs figures show that China imported 7 . 73 mln tonnes of grain in 1986 , up from 5 . 97 mln in 1985 but down from a record 16 . 15 mln in 1982 . The newspaper quoted Deng as saying that grain output is one of several key issues that will influence the whole development of the economy . It did not give the context of his remarks . The 1987 grain production target is 405 mln , up from 391 mln in 1986 . The newspaper quoted Deng as saying that the situation has reached the point where "" pigs are not fed , there is not enough grain and increases in output have slowed ."" "" We should in our overall economic planning put agriculture in its proper place to reach our target of 480 mln tonnes by the year 2000 ,"" he said . "" We must avoid the situation in recent years of importing more than 10 mln tonnes of grain ."" The paper quoted Deng as saying that the State Council has decided to raise the price of five grains , including corn and rice , unchanged since 1978 , but it gave no details ."
385,"BANGLADESH FORECASTS GDP GROWTH OF 4 . 4 PCT Gross domestic product is expected to grow by 4 . 4 pct in the year ending June 30 , Finance Minister Mohammad Syeduzzaman told reporters . Inflation fell to an estimated 12 pct this fiscal year from 17 pct in 1981 / 82 , he said last night . The World Bank and other independent sources have said inflation would be around 15 pct in 1986 / 87 . Syeduzzaman said remittances from expatriates would rise to 600 mln dlrs this year from 425 mln in 1981 / 82 . Foreign exchange reserves at end - June are projected at 680 mln dlrs compared with 105 mln in 1981 / 82 , he said . Syeduzzaman said the export target has been set at 900 mln dlrs this year against 626 mln in 1981 / 82 . Commitments for foreign loans and grants total more than five billion dlrs in 1986 / 87 , against 3 . 54 billion five years previously , he said . The government ' s liberal industrial policy has attracted investment commitments totalling 250 mln dlrs , he said Foodgrain output is estimated at 16 . 4 mln tonnes this year , up from 16 . 12 mln in 1985 / 86 and 14 . 4 mln in 1981 / 82 . Government officials have said Bangladesh must import nearly two mln tonnes of grain annually up to 1990 , when the government expects to attain self - sufficiency in food ."
386,"BEGHIN - SAY INCREASES CAPITAL TO FINANCE EXPANSION French sugar group Beghin - Say , which is 49 . 6 pct owned by Italy ' s Gruppo Ferruzzi , is to raise its capital to 703 mln francs from 527 mln through a three - for - one issue of shares and investment certificates to finance expansion , president Jean - Marc Vernes told analysts . For the first stage Beghin - Say will issue some 2 . 05 mln new 65 franc shares at 500 francs to increase capital to 660 mln francs . The share currently trades at 734 francs . Then 658 , 000 new 65 franc investment certificates will be issued at 400 francs , raising capital to 703 mln francs . The capital increase will bring the group around 1 . 2 billion francs in new funds to finance its expansion plans . These include the possible acquisition of the Corn Products maize starch plant at Haubourdin in northern France , Vernes said . Ferruzzi is one of several groups bidding to buy all of Corn Products ' installations in Europe . Apart from the French plant , these include three factories in each of Italy and West Germany , two in Britain and Spain and one in the Netherlands and Denmark . Corn Products has put a 650 mln dlr price tag on the installations , and Beghin - Say estimates that acquisition of the Haubourdin plant would cost between 80 and 100 mln dlrs , Vernes said . If this bid fails , Beghin - Say would consider acquiring and developing two other French plants , either in the maize or wheat starch sector . Beghin - Say is also planning to finance European expansion for its Kaysersberg subsidiary , another major reason for its capital increase . Kaysersberg , which was transformed from a division of Beghin - Say into a fully - fledged chemical subsidiary last year , has been holding talks with other European companies on possible accords , Vernes said . He added the company could be introduced onto the Paris Bourse in the near future ."
387,"AUSTRALIAN WHEAT AREA TO FALL , FORECASTER SAYS Australian wheat plantings are forecast to fall to 10 . 40 mln hectares in 1987 / 88 from 11 . 72 mln sown in 1986 / 87 , Australian Wheat Forecasters Pty Ltd ( AWF ) said in its first preliminary crop forecast . But there was no reason to expect Australian production in 1987 / 88 would be less than the 16 . 5 mln tonnes of last year , the private forecaster said , as crops in New South Wales and Queensland suffered from poor yields last season . Most of the fall in plantings was expected in Western Australia while state average yields would be assisted by growers sowing wheat on fallows and rest paddocks , it said . The main reason for a low Western Australia estimate was a poor profit outlook under cost , credit and yield pressures . But in the eastern states the wheat area should hold up provided that rainfall between now and June is not less than average , AWF said . Although some farmers were saying they intended to cut back wheat area by 20 pct , AWF said this was unlikely since they needed cash flow and there were problems with alternative crops . "" The lack of statutory marketing for oilseeds , pulses and oats is a cause for concern if those crops are to comprise a high proportion of growers ' income ,"" AWF said . AWF ' s state area forecasts in mln hectares , with 1986 / 87 production in mln tonnes , are as follows ( crop forecasts were not given for the new wheat year ) Area Crop 1987 / 88 1986 / 87 1986 / 87 Queensland 0 . 82 0 . 82 0 . 95 N . S . W . 3 . 07 3 . 17 4 . 40 Victoria 1 . 53 1 . 63 3 . 25 S . Australia 1 . 45 1 . 64 2 . 30 W . Australia 3 . 53 4 . 46 5 . 60"
388,"WEST GERMAN BARLEY , RAPE AFFECTED BY WINTER KILL Winter kill has probably affected West German winter barley and rapeseed to an above average degree this season , West German grain trader Alfred C . Toepfer said in its latest report . It is too soon to assess the extent of the damage , but it is likely that northern West German crops are particularly at risk because of insufficient snow cover , it said . The soil needs to warm up rapidly and moisture content must improve to avoid further delays to spring field work , it added ."
