,col
58,"BRAZIL DEBT SEEN PARTNER TO HARD SELL TACTICS Brazil ' s recent announcement of a suspension in interest payments on 68 billion dlrs of foreign debt gave the banking system the jitters and confirmed views among many international economists and commodities analysts that Brazil will continue to flex its trading muscles in 1987 . The developing world ' s most indebted nation is also its most prolific exporter of agricultural commodities such as coffee and soybeans , and might maximize foreign exchange revenue by selling hard on world markets , economists said . "" That sounds like a reasonable strategy . But there is no way they can trade their way out of this situation ,"" Aldo Roldan , Vice President for International Services at Chase Econometrics , said . Roldan told Reuters that Brazil not only had to tackle the problems of satisfying domestic demand and competing on glutted world markets , but also had to work to make its position on foreign exchange markets more profitable . "" Domestic costs have increased ( due to inflation ) and exporters have not had the same offsetting movement in exchange rates ,"" Roldan said . The Chase economist also said commodities markets were depressed and generally did not appear very promising for a country like Brazil , where pure commodities account for some 50 pct of exports and in 1986 had a total value of around 23 billion dlrs . But he added : "" They are always pretty aggressive and they have good foreign marketing channels ."" Analysts said a key factor in Brazilian trade will be coffee , and even without background pressure from foreign creditors the world ' s largest producer was expected to hit the market this year with a vengeance . Negotiations between International Coffee Organization ( ICO ) members to re - establish producer export quotas broke up earlier this week with major producers and consumers accusing each other of intransigence . "" Brazil would not tolerate a change in ICO regulations , which others wanted changed ,"" one senior coffee dealer said . The dealer , who declined to be named , said Brazil wanted to preserve its market share . At the end of the talks , he said Brazil hinted it could sell more than anyone else and others would suffer . Brazil will be an aggressive seller under any scenario but as yet there is no sign of unusually heavy Brazilian sales , the dealer said . "" If they do come into the market at this level it will go lower and you could breach a dollar , ninety or eighty cents ,"" he said . New York coffee futures for May delivery settled 2 . 29 cents lower Thursday at 104 . 68 cents a lb , while more distant deliveries fell the six - cent maximum trading limit . President of the Brazilian Coffee Institute , Jorio Dauster told a press conference in Rio de Janeiro today that Brazil has no set target for its coffee exports following the breakdown of the ICO talks on export quotas . Many economists and analysts believe soybeans could be the focus of possible stepped - up Brazilian marketing efforts . "" They will be more aggressive this year than they have ever been ,"" according to Richard Loewy , analyst for Prudential - Bache Securities Inc . Loewy believes the foreign debt problem , a good crop , plus difficulties with storage would help motivate selling of the Brazil soybean crop . "" Brazilian farmers also need cash flow and they can ' t afford to store the crops ,"" he said . The Chicago soybean complex has been nervous for some time about large South American crops developing under near ideal conditions towards record yields . "" We are going to see a very rapid decline , earlier than usual , this year in our ( U . S .) exports ,"" Loewy said . Tommy Eshleman , economist for the American Soybean Association ( ASA ), said this year ' s Brazilian soybean harvest could total 18 mln tonnes , versus 13 . 7 mln last year . Marketings will be very aggressive this summer when prices are usually high relative to the rest of the year due to the vulnerability of the U . S . crop to bad growing weather . Another incentive to sell might be trade anticipation of a reduction in the U . S . government soybean loan rate , offered to farmers who give crops as collateral , Eshleman said . He said there has been some uncertainty this year about the soybean loan rate , which acts as an effective floor for prices by keeping supplies away from the free market . Farmers can forfeit their beans to the government rather than repay the loan . "" We ' re getting into a period when they ( Brazil ) are starting to harvest and starting to export ,"" Eshleman said . But he added it will be a while before U . S . exports fall to below 10 mln bushels a week from around 20 mln bushels currently . Jose Melicias from the research department of Drexel Burnham Lambert said Brazil would be trying to export as much as it can this year because of its economic situation . He said the debt situation was a major consideration . "" The Brazilian government also does not have enough money to pay for storage ,"" he added . Asked if a return to an inflationary environment in Brazil would make farmers inclined to hold onto crops , Melicias said it would not make a big difference . On other commodity markets , Brazil ' s selling impact may be muted no matter its need to generate capital . Brazil is faced with a poor 1986 / 87 sugar harvest , which could limit exports to the world market , analysts said . The country may have oversold and be unable to honor export commitments , and this plus higher domestic demand caused by consumer price subsidies on ethanol and refined sugar , will give it little room to stretch exports , they said . Brazil ' s other major crop , cocoa , is in its third year of surplus . "" Cocoa consumption is basically flat and last year it fell , so I don ' t think they can start throwing out cocoa and find many more markets for it ,"" one analyst said . "" If they come out as aggressive sellers , the market would collapse and they can ' t afford to do that ,"" she added ."
59,"INDONESIAN SUGAR OUTPUT SEEN SHORT OF TARGET Indonesia ' s raw sugar output is likely to be 1 . 8 mln tonnes in calendar 1987 , unchanged from 1986 and below the government ' s 1987 forecast of 2 . 5 mln , the U . S . Embassy said in its agricultural outlook for 1987 . Indonesia bought 162 , 500 tonnes of raw sugar on world markets in late 1986 , the report said . The embassy estimated Indonesia ' s calendar 1986 raw sugar production at 1 . 8 mln tonnes , against a government estimate of 1 . 99 mln . It said that Indonesia ' s move into sugar self - sufficiency in 1984 may have been short - lived . The report said , "" The government continues to promote sugarcane production through its smallholder intensification program and a relatively high guaranteed price to sugarcane producers . "" However , there are considerable indications that farmers are reluctant to plant cane because its economic return is not as good as that of other crops ."""
60,"INDIA AGAIN IN MARKET FOR SUGAR - TRADE India has called a fresh buying tender for up to four 13 , 000 tonne cargoes of white sugar on March 11 , traders here said . The tender calls for one cargo of prompt sugar and two to three with March / April shipment sugar , or the same as the eight cargoes bought at a tender two days ago . That tender originally only sought two to three cargoes but resulted in the sale of eight . India also granted the sellers options to sell twice that amount at the same price but for April / May shipment . Depending on prices , traders said it would be likely for India again to buy more than the tonnage formally sought ."
61,"MGE PLANNING APRIL 6 START UP OF HFCS CONTRACT The Minneapolis Grain Exchange ( MGE ) will start trading futures contracts in high fructose corn syrup on April 6 if the Commodity Futures Trading Commission ( CFTC ) approves the contract as expected next week . Pat Henderson , spokesperson for the MGE , said the exchange expects contract approval at CFTC ' s Tuesday meeting . It has been under review since the exchange submitted the proposal in December , 1985 . The proposed contract is based on 48 , 000 pound lots of 55 - pct high fructose corn syrup , the equivalent of one tank truck of the sweetening agent derived from corn in the wet milling process . The syrup , commonly called HFCS - 55 , is most commonly used as a sweetener in soft drinks and other beverages . Delivery would be by shipping certificate from production facilities designated by the exchange . The contract , designated by the symbol "" HF ,"" would trade from 0900 to 1315 CST . Months traded would correspond with the Chicago corn futures months of March , May , July , September and December . Contract price will be quoted per hundred weight , with a minimum price fluctuation of one cent and maximum fluctuation of one dlr per CWT . "" We hope the producers and users of fructose will be actively involved , those producers being the large processors , the corn wet millers , and the users being the beverage bottlers ,"" Henderson said . "" But there are potentials for all types of people to use it . There is quite a list of industries that utilize fructose ."""
62,"INDIAN SUGAR OUTPUT RISES IN FIRST FOUR MONTHS India ' s sugar output to January 31 in the 1986 / 87 season ( October / September ) rose to 3 . 66 mln tonnes from 3 . 46 mln in the same 1985 / 86 period , the Indian Sugar Mills Association said . Total offtake in the first four months of the current year was 2 . 71 mln tonnes ( including 241 , 000 tonnes imported ) for domestic use and 4 , 000 tonnes for export , against 2 . 81 mln tonnes ( including 993 , 000 imported ) for domestic use and 3 , 000 tonnes for export in the corresponding period of 1985 / 86 . Factory stocks at end - January were 3 . 05 mln tonnes ( 96 , 000 imported ) against 3 . 13 mln ( 96 , 000 imported ) a year earlier ."
63,"BANGLADESH SUGAR PRODUCTION ALMOST DOUBLES Bangladesh ' s sugar production increased by nearly 60 , 000 tonnes over last year ' s season to total 140 , 000 tonnes at the end of this year ' s season , the Sugar and Food Industries Corp said . The increased output will enable Bangladesh to cut imports . Corporation officials told Reuters the country has already imported 37 , 000 tonnes of sugar and will buy 113 , 000 tonnes more to make up shortfall in the 1986 / 87 year ending June 30 . Imports in 1985 / 86 totalled 224 , 000 tonnes , of which nearly 100 , 000 tonnes are still in stock , they said without giving further details ."
64,"CHINA RAISES CROP PRICES TO INCREASE OUTPUT China has raised the prices it pays farmers for cotton , edible oil , sugar cane and beets to reverse a decline in output in 1986 , He Kang , Minister of Agriculture , Animal Husbandry and Fisheries said . The China Daily quoted He as saying China should adopt intensive farming to increase per hectare output and improve crop quality and maintain arable land at 111 mln hectares . He gave no details of the price increases . On grain , He said the state will cut the quota it purchases from farmers by 50 mln tonnes and abolish the practice of purchasing through agents . He said the state will increase investment in agriculture and supplies of fertiliser , diesel oil and other production materials and stabilise fertiliser and diesel oil prices . The state offers cheap fertiliser and diesel oil and payment in advance to farmers who contract to supply grain at a low state - fixed price . He said China aims to produce between 425 and 450 mln tonnes of grain by 1990 , up from a target of 405 mln this year and an actual 391 mln last year . He gave no more details ."
65,"AUSTRALIA SELLS 180 , 000 TONNES OF SUGAR TO USSR Australia sold 180 , 000 tonnes of raw sugar to the Soviet Union for shipment in the next few weeks , Queensland Primary Industries Minister Neville Harper said . Loading of a 50 , 000 - tonne cargo on the Soviet freighter Nikolay Kuznetsov for shipment to Odessa was completed today at the Lucinda terminal , he said in a statement . The balance will be shipped from Mackay by end - March , Harper said . Australia exported 159 , 000 tonnes of sugar to the Soviet Union in 1986 ."
66,"MGE CORN SYRUP FUTURES CONTRACT CLEARS HURDLE The staff of the Commodity Futures Trading Commission , CFTC , recommended that the regulatory agency approve the Minneapolis Grain Exchange ' s application to trade high fructose corn syrup - 55 , HFCS - 55 , futures contracts . The commission is expected to approve the application at a meeting tomorrow . The proposed contract would provide for the delivery of 48 , 000 lbs , plus or minus two pct , of bulk HFCS - 55 , a liquid food and beverage sweetener produced through processed corn starch by corn refiners . Under proposed rules , a shipping certificate has a limited life , as it expires 30 days following the last day of trading of the expiring contract month . A premium charge of 14 . 40 dlrs per contract per day would be assessed under the proposal ."
67,"EC SUGAR IMPORT LEVIES The following import levies for white and raw sugar are effective tomorrow , in European currency units ( ecu ) per 100 kilos . White sugar , denatured and non - denatured 49 . 70 versus 50 . 05 previously . Raw sugar , denatured and non - denatured 41 . 35 versus 41 . 35 previously . The rate for raws is based on 92 pct yield ."
68,"LCE AND IPE ELECT FIRST TRADED OPTIONS MEMBERS The first 23 members have been elected to the joint traded options facility of the London Commodity Exchange ( LCE ) and the International Petroleum exchange ( IPE ), the exchanges said in a statement . More firms have applied and the final tranche will be admitted on April one and trading is planned to start in early June on the new trading floor on Commodity Quay . Traded options need a volatile and liquid futures base to succeed and chairman of the joint formation committee Jack Patterson said the existing LCE cocoa , coffee , sugar and IPE gas oil contracts should have no difficulty in providing this ."
69,"INDIA TO HOLD WHITE SUGAR BUYING TENDER India will hold a buying tender on Wednesday , March 4 , for two to three cargoes of white sugar for March / April shipment , traders said ."
70,"EC COMMISSION DECLINES COMMENT ON SUGAR OFFER The European Community ( EC ) Commission declined to give an official reaction to reports that a group of european operators plan to offer one mln tonnes of sugar into intervention in protest at Commission export policies . However , a spokesman for the Commission confirmed the offers had been made to intervention agencies in various member states , and said it would now take up to three weeks for the agencies concerned to complete all necessary documentation . The spokesman said that under current regulations , the EC would have to accept all the offers if there were no technical problems . The spokesman said the Commission would only have to reimburse the member state for the cost of buying - in the sugar after the product was sold out of intervention stores at a later date . He said that at present there was virtually no sugar held in intervention stores . Last year , 45 , 000 tonnes were sold into intervention and during the 1984 - 85 campaign 108 , 000 tonnes ."
71,"TRADE SAYS EC SUGAR TENDER HARD TO FORECAST Traders here and in Paris said the results of today ' s EC white sugar tender are hard to forecast because of plans by a group of French , West German , Dutch and Belgian operators to sell one mln tonnes of sugar into intervention . London traders said bids for licences have been reported between 43 . 00 and 44 . 00 Ecus per 100 kilos and if any licences are granted they are likely to be towards the lower end of that range , possibly 43 . 30 / 43 . 50 Ecus . Traders in Paris said they expect maximum rebates of between 43 and 43 . 50 Ecus . Other than the Commission releasing no sugar for export , the likely tonnage is expected to be very small , the London traders said , while the French sources declined to estimate volume in view of the psychological impact of the planned sales into intervention in protest against EC export policies . Last week licences for 60 , 500 tonnes were awarded at a maximum rebate of 43 . 147 Ecus ."
72,"AGENCY TO REVIEW JOHNSON / JOHNSON & lt ; JNJ > SWEETNER Johnson and Johnson said the U . S . Food and Drug Administration has notified the company its food additive petition for a high - intensity sweetener has been formally accepted and now will be reviewed by the agency . The company said the product , with the generic name of sucralose , is made from sugar and tastes like sugar , but is about 600 times sweeter . It yields no calories and does not promote tooth decay ."
73,"AGENCY TO REVIEW JOHNSON AND JOHNSON SWEETENER Johnson and Johnson said the U . S . Food and Drug Administration has notified the company its food additive petition for a high - intensity sweetener has been formally accepted and now will be reviewed by the agency . The company said the product , with the generic name of sucralose , is made from sugar and tastes like sugar , but is about 600 times sweeter . It yields no calories and does not promote tooth decay . Johnson and Johnson said the sweetner is being jointly developed with Tate and Lyle PLC & lt ; TATL >. Tate and Lyle is seeking approval in Canada , the United Kingdom and other European countries , Johnson and Johnson said . The company noted its petition covering the product and its safety evaluation were submitted to the FDA last month . While awaiting FDA approval , the company said , it is proceeding with plans for commercialization through its McNeil Specialty Products Co subsidiary . Johnson and Johnson said it is operating under a licensing agreement with Tate and Lyle , whose collaborative research with scientists at Queen Elizabeth College in London led to the discovery of Sucralose in 1976 . Patents and licensing agreements control the use of sucralose through the year 2001 , Johnson and Johnson said . Sucralose is a chlorinated derivative of ordinary sugar . The carbon - chloride bonds in sucralose are stable and are not broken during digestion or metabolism . Sucralose is essentially not metabollized by the body . The chlorine content enhances sweetness without providing calories ."
74,"NY TRADERS SAY E . C . SOLD 71 , 000 TONNES OF WHITE SUGAR AT TENDER . NY TRADERS SAY E . C . SOLD 71 , 000 TONNES OF WHITE SUGAR AT TENDER ."
75,UK INTERVENTION BD SAYS EC SETS WHITE SUGAR TENDER REBATE 43 . 248 ECUS . UK INTERVENTION BD SAYS EC SETS WHITE SUGAR TENDER REBATE 43 . 248 ECUS .
76,"THAI SUGAR PRODUCTION INCREASES Thai sugar production totalled 960 , 788 tonnes in January , an increase of 12 . 7 pct on January 1986 , according to figures received by the International Sugar Organization . November and December production figures also exceeded last year ' s totals with the result that output in the first three months of the season showed a 23 . 1 pct increase over 1985 / 86 . Production in the November 1986 to January 1987 period totalled 1 . 29 mln tonnes . Thai exports in December and January were down , however . January exports fell from 73 , 164 to 35 , 910 tonnes . Domestic consumption increased 7 . 3 pct to 192 , 069 tonnes for the three month period , but this was not sufficient to prevent a significant rise in stocks , which climbed to 1 . 62 mln tonnes by the end of January , compared with 1 . 52 mln a year earlier . Thai Agricultural Ministry officials have previously forecast a decline in 1986 / 87 raws output to around 2 . 3 mln tonnes from 2 . 48 mln in 1985 / 86 ."
77,"LICHT SEES RISE IN EUROPEAN BEET AREA : TRADE West German sugar statistician F . O . Licht estimates European beet plantings this year at 7 . 22 mln hectares compared with a revised 1986 figure of 7 . 21 mln , traders said . In its first estimate for 1987 , it puts EC plantings at 1 . 85 mln hectares compared with 1 . 89 mln in 1986 , while it estimates sowings in Western Europe ( including EC ) at 2 . 49 mln hectares compared with 2 . 50 mln in 1986 . Traders said Licht forecasts Eastern Europe plantings at 4 . 73 mln hectares against 4 . 72 mln in 1986 ."
78,"GERMAN SUGAR OFFERS PUT AT ABOUT 100 , 000 TONNES The West German intervention board said about 100 , 000 tonnes of sugar have been offered into intervention so far . A spokesman , speaking from Frankfurt , told Reuters offers have increased recently but contracts have not yet been concluded . A European Commission spokesman in Brussels earlier confirmed that one mln tonnes of sugar had been offered to intervention boards in various member states . The intervention board spokesman in Frankfurt said , "" One million tonnes is an awful lot and the Community ' s coffers are almost empty . This could turn into a serious political problem ."" West German trade sources said they believed the one mln tonne offer by the EC sugar industry into intervention would have a neutral market impact overall ."
79,"LICHT SEES STAGNANT EUROPEAN BEET AREA The overall area devoted to sugar beet in Europe is forecast to remain stagnant this year at 7 . 22 mln hectares compared with 7 . 21 mln ha in 1986 , West German statistician F . O . Licht said . It was feared that the recent steep rise in sugar prices would have a marked effect on planting intentions this year , Licht said , but judging by this first estimate the effect was probably minimal . The total beet area in the European Community is forecast to fall two pct to 1 . 85 mln ha against 1 . 89 mln in 1986 . The total Western Europe area is put at 2 . 49 mln ha , against 2 . 50 mln in 1986 . Eastern Europe area is forecast at 4 . 73 mln ha against 4 . 72 mln . Individual West Europe country estimates , in 1 , 000 hectares ( with 1986 figures in brackets ), are , Belgium / Luxembourg 114 ( 118 ), Denmark 69 ( 69 ), France 419 ( 421 ), Greece 35 ( 44 ), Ireland 36 ( 38 ), Italy 270 ( 275 ), Netherlands 129 ( 138 ), Portugal 1 ( 1 ), Spain 192 ( 190 ), U . K . 200 ( 201 ), West Germany 385 ( 399 ), Austria 32 ( 28 ), Finland 30 ( 31 ), Sweden 51 ( 52 ), Switzerland 15 ( 14 ), Turkey 355 ( 340 ), Yugoslavia 160 ( 136 ). Eastern Europe plantings are forecast as follows , USSR 3400 ( 3440 ), Albania 10 ( 9 ), Bulgaria 52 ( 50 ), Czechoslovakia 195 ( 196 ), East Germany 210 ( 205 ), Hungary 108 ( 96 ), Poland 460 ( 440 ), Romania 295 ( 280 ). On the basis of average yields this year , Licht said these area forecasts pointed to a total European beet sugar crop in 1987 / 88 of 29 . 8 mln tonnes , raw value , down from 31 . 4 mln tonnes in 1986 / 87 . Licht said sugar yields were fairly high last season , thanks to favourable weather , and this increases the chances of a significant reduction in production in 1987 / 88 . Based on average yields , EC beet sugar production could fall nearly 10 pct this year to 13 . 5 mln tonnes from 14 . 9 mln in 1986 / 87 , while total Western Europe production could be 16 . 9 mln tonnes against 18 . 1 mln . Eastern Europe production could be 12 . 9 mln tonnes against 13 . 3 mln in 1986 / 87 ."
80,"EC COMMISSION REJECTS SUGAR THREATS - SOURCES The European Community Commission has told EC member states that it is not prepared to discuss EC sugar prices while sugar traders threaten to make a huge sale into intervention stocks to protest against its policies , Commission sources said . "" Our position is that we are not willing to discuss the problems of market prices at a time when traders are making threats ,"" one source said . The sources said the Commission ' s view was made clear at a meeting of its sugar management committee today . They said French , West German and Dutch officials had informed the committee that traders in their countries intended to sell just over 850 , 000 tonnes of sugar into EC intervention stocks . The Commission riposted by signalling that it would sell the sugar sold into intervention back onto the EC market by tender , a move that would push down prices . The sources said French traders planned to sell 775 , 000 tonnes into intervention stocks , West German traders 7 , 500 tonnes and Dutch traders 2 , 500 ."
81,"CHINA JANUARY WHEAT / SUGAR IMPORTS BELOW YEAR AGO China ' s wheat imports in January were 218 , 000 tonnes , down from 393 , 000 in January 1986 , the China Daily Business Weekly said , quoting customs figures . It said imports of sugar were 25 , 165 tonnes , down from 54 , 000 , but exports of rice rose to 71 , 144 tonnes from 20 , 000 . It gave no more details ."
82,"DUTCH SUGAR TRADE DENY INVOLVEMENT IN OFFER Dutch sugar traders deny involvement in a plan to offer more than 850 , 000 tonnes of sugar to intervention in protest at EC export policy and prices , traders told Reuters . Although some 2 , 500 tonnes of sugar have been offered to intervention in the Netherlands , Dutch producers and traders said this sugar was actually Belgian and was being offered by the Belgian industry . "" We sympathise with the actions of the French , West German and Belgian traders and producers , but we are not party to it ,"" a spokesman said . EC Commission sources said yesterday French traders planned to sell 775 , 000 tonnes into intervention stocks , West German traders 75 , 000 tonnes and Dutch traders 2 , 500 . Dutch trade sources gave the same figure for France , but estimated up to 110 , 000 tonnes offered by German traders and producers . The Dutch spokesman added , "" The weekly export tender policy and prices are squeezing the European sugar industry , and this is the only way in which they can really register their protest . "" These are desperate actions , but we believe that most of this offered sugar will be withdrawn within the three - week breathing space allowed ."""
